{
  "label": "Main tweakdefs",
  "variable": "tweakdefs2",
  "generator": "json-schema",
  "definitions": [
    {
      "name": "Raptor Air Fighter Basic Tweaks",
      "description": "Adjusts weapon properties for Raptor Air Fighter Basic",
      "scope": "UnitDefsLoop",
      "conditions": [
        {
          "type": "nameStartsWith",
          "prefix": "raptor_air_fighter_basic"
        }
      ],
      "mutations": [
        { "op": "set", "weapon_target": "all", "target": "name", "value": "Spike" },
        { "op": "set", "weapon_target": "all", "target": "accuracy", "value": 200 },
        { "op": "set", "weapon_target": "all", "target": "collidefriendly", "value": 0 },
        { "op": "set", "weapon_target": "all", "target": "collidefeature", "value": 0 },
        { "op": "set", "weapon_target": "all", "target": "avoidfeature", "value": 0 },
        { "op": "set", "weapon_target": "all", "target": "avoidfriendly", "value": 0 },
        { "op": "set", "weapon_target": "all", "target": "areaofeffect", "value": 64 },
        { "op": "set", "weapon_target": "all", "target": "edgeeffectiveness", "value": 0.3 },
        { "op": "set", "weapon_target": "all", "target": "explosiongenerator", "value": "custom:raptorspike-large-sparks-burn" },
        { "op": "set", "weapon_target": "all", "target": "cameraShake", "value": {} },
        { "op": "set", "weapon_target": "all", "target": "dance", "value": {} },
        { "op": "set", "weapon_target": "all", "target": "interceptedbyshieldtype", "value": 0 },
        { "op": "set", "weapon_target": "all", "target": "model", "value": "Raptors/spike.s3o" },
        { "op": "set", "weapon_target": "all", "target": "reloadtime", "value": 1.1 },
        { "op": "set", "weapon_target": "all", "target": "soundstart", "value": "talonattack" },
        { "op": "set", "weapon_target": "all", "target": "startvelocity", "value": 200 },
        { "op": "set", "weapon_target": "all", "target": "submissile", "value": 1 },
        { "op": "set", "weapon_target": "all", "target": "smoketrail", "value": 0 },
        { "op": "set", "weapon_target": "all", "target": "smokePeriod", "value": {} },
        { "op": "set", "weapon_target": "all", "target": "smoketime", "value": {} },
        { "op": "set", "weapon_target": "all", "target": "smokesize", "value": {} },
        { "op": "set", "weapon_target": "all", "target": "smokecolor", "value": {} },
        { "op": "set", "weapon_target": "all", "target": "soundhit", "value": {} },
        { "op": "set", "weapon_target": "all", "target": "texture1", "value": {} },
        { "op": "set", "weapon_target": "all", "target": "texture2", "value": {} },
        { "op": "set", "weapon_target": "all", "target": "tolerance", "value": {} },
        { "op": "set", "weapon_target": "all", "target": "tracks", "value": 0 },
        { "op": "set", "weapon_target": "all", "target": "turnrate", "value": 60000 },
        { "op": "set", "weapon_target": "all", "target": "weaponacceleration", "value": 100 },
        { "op": "set", "weapon_target": "all", "target": "weapontimer", "value": 1 },
        { "op": "set", "weapon_target": "all", "target": "weaponvelocity", "value": 1000 },
        { "op": "set", "weapon_target": "all", "target": "weapontype", "value": {} },
        { "op": "set", "weapon_target": "all", "target": "wobble", "value": {} }
      ]
    },
    {
      "name": "Commander Tweaks",
      "description": "Adjusts customparams and featuredefs for Commanders",
      "scope": "UnitDefsLoop",
      "conditions": [
        { "type": "nameMatch", "regex": "^[acl][ore][rgm]com" },
        { "type": "nameNotMatch", "regex": "_scav$" }
      ],
      "mutations": [
        {
          "op": "table_merge",
          "target": "customparams",
          "value": {
            "combatradius": 0,
            "fall_damage_multiplier": 0,
            "paratrooper": true,
            "wtboostunittype": {}
          }
        },
        {
          "op": "table_merge",
          "target": "featuredefs",
          "value": {
            "dead": {
              "damage": 9999999,
              "reclaimable": false,
              "mass": 9999999
            }
          }
        }
      ]
    },
    {
      "name": "Raptor Turret Buffs",
      "description": "Doubles health and adjusts reload/range for turrets",
      "scope": "UnitDefsLoop",
      "conditions": [
        {
          "type": "nameInList",
          "names": [
            "raptor_antinuke", "raptor_turret_acid_t2_v1", "raptor_turret_acid_t3_v1", "raptor_turret_acid_t4_v1",
            "raptor_turret_antiair_t2_v1", "raptor_turret_antiair_t3_v1", "raptor_turret_antiair_t4_v1",
            "raptor_turret_antinuke_t2_v1", "raptor_turret_antinuke_t3_v1", "raptor_turret_basic_t2_v1",
            "raptor_turret_basic_t3_v1", "raptor_turret_basic_t4_v1", "raptor_turret_burrow_t2_v1",
            "raptor_turret_emp_t2_v1", "raptor_turret_emp_t3_v1", "raptor_turret_emp_t4_v1", "raptor_worm_green"
          ]
        }
      ],
      "mutations": [
        { "op": "set", "target": "maxThisUnit", "value": 10 },
        { "op": "multiply", "target": "health", "value": 2 },
        { "op": "multiply", "weapon_target": "all", "target": "reloadtime", "value": 0.666666 },
        { "op": "multiply", "weapon_target": "all", "target": "range", "value": 0.5 }
      ]
    },
    {
      "name": "Flying Builder Cleanup",
      "description": "Removes explosion from flying builders",
      "scope": "UnitDefsLoop",
      "conditions": [
        { "type": "fieldValue", "field": "builder", "value": true },
        { "type": "fieldValue", "field": "canfly", "value": true }
      ],
      "mutations": [
        { "op": "set", "target": "explodeAs", "value": "" },
        { "op": "set", "target": "selfDestructAs", "value": "" }
      ]
    },
    {
      "name": "Clone Hive Spawn",
      "description": "Creates Hive Spawn from Raptor Swarmer",
      "scope": "Global",
      "conditions": [],
      "mutations": [
        {
          "op": "clone_unit",
          "source": "raptor_land_swarmer_basic_t1_v1",
          "target": "raptor_hive_swarmer_basic",
          "mutations": [
            { "op": "set", "target": "name", "value": "Hive Spawn" },
            {
              "op": "table_merge",
              "target": "customparams",
              "value": {
                "i18n_en_humanname": "Hive Spawn",
                "i18n_en_tooltip": "Raptor spawned to defend hives from attackers."
              }
            }
          ]
        }
      ]
    },
    {
      "name": "Clone Armored Assault Raptor",
      "description": "Creates Armored Assault Raptor",
      "scope": "Global",
      "conditions": [],
      "mutations": [
        {
          "op": "clone_unit",
          "source": "raptor_land_assault_basic_t2_v1",
          "target": "raptor_hive_assault_basic",
          "mutations": [
            { "op": "set", "target": "name", "value": "Armored Assault Raptor" },
            {
              "op": "table_merge",
              "target": "customparams",
              "value": {
                "i18n_en_humanname": "Armored Assault Raptor",
                "i18n_en_tooltip": "Heavy, slow, and unyieldingâ€”these beasts are made to take the hits others cant."
              }
            }
          ]
        }
      ]
    }
  ]
}
