{
  "label": "Unit Launchers",
  "variable": "tweakdefs9",
  "generator": "json-schema",
  "definitions": [
    {
      "name": "Create Meatball Launcher",
      "scope": "Global",
      "conditions": [],
      "mutations": [
        {
          "op": "clone_unit",
          "source": "armbotrail",
          "target": "armmeatball",
          "mutations": [
            { "op": "table_merge", "target": "customparams", "value": { "i18n_en_humanname": "Meatball Launcher" } },
            { "op": "set", "weapon_target": "arm_botrail", "target": "range", "value": 7550 },
            { "op": "set", "weapon_target": "arm_botrail", "target": "metalpershot", "value": 5300 },
            { "op": "set", "weapon_target": "arm_botrail", "target": "energypershot", "value": 96000 },
            { "op": "set", "weapon_target": "arm_botrail", "target": "reloadtime", "value": 0.5 },
            { "op": "table_merge", "weapon_target": "arm_botrail", "target": "customparams", "value": { "stockpilelimit": 50, "spawns_name": "armmeatball" } }
          ]
        }
      ]
    },
    {
      "name": "Create Assimilator Launcher",
      "scope": "Global",
      "conditions": [],
      "mutations": [
        {
          "op": "clone_unit",
          "source": "armbotrail",
          "target": "armassimilator",
          "mutations": [
            { "op": "table_merge", "target": "customparams", "value": { "i18n_en_humanname": "Assimilator Launcher" } },
            { "op": "set", "weapon_target": "arm_botrail", "target": "range", "value": 7550 },
            { "op": "set", "weapon_target": "arm_botrail", "target": "metalpershot", "value": 4500 },
            { "op": "set", "weapon_target": "arm_botrail", "target": "energypershot", "value": 80000 },
            { "op": "set", "weapon_target": "arm_botrail", "target": "reloadtime", "value": 0.5 },
            { "op": "table_merge", "weapon_target": "arm_botrail", "target": "customparams", "value": { "stockpilelimit": 50, "spawns_name": "armassimilator" } }
          ]
        }
      ]
    },
    {
      "name": "Create Epic Pawn Launcher",
      "scope": "Global",
      "conditions": [],
      "mutations": [
        {
          "op": "clone_unit",
          "source": "armbotrail",
          "target": "armpwt4",
          "mutations": [
            { "op": "table_merge", "target": "customparams", "value": { "i18n_en_humanname": "Epic Pawn Launcher" } },
            { "op": "set", "weapon_target": "arm_botrail", "target": "range", "value": 7550 },
            { "op": "set", "weapon_target": "arm_botrail", "target": "metalpershot", "value": 14200 },
            { "op": "set", "weapon_target": "arm_botrail", "target": "energypershot", "value": 480000 },
            { "op": "set", "weapon_target": "arm_botrail", "target": "reloadtime", "value": 0.5 },
            { "op": "table_merge", "weapon_target": "arm_botrail", "target": "customparams", "value": { "stockpilelimit": 50, "spawns_name": "armpwt4" } }
          ]
        }
      ]
    },
    {
      "name": "Create Armada T1 Launcher",
      "scope": "Global",
      "conditions": [],
      "mutations": [
        {
          "op": "clone_unit",
          "source": "armbotrail",
          "target": "armt1",
          "mutations": [
            { "op": "table_merge", "target": "customparams", "value": { "i18n_en_humanname": "Armada T1 Launcher" } },
            { "op": "set", "weapon_target": "arm_botrail", "target": "stockpiletime", "value": 0.5 },
            { "op": "set", "weapon_target": "arm_botrail", "target": "range", "value": 7550 },
            { "op": "set", "weapon_target": "arm_botrail", "target": "metalpershot", "value": 250 },
            { "op": "set", "weapon_target": "arm_botrail", "target": "energypershot", "value": 12500 },
            { "op": "set", "weapon_target": "arm_botrail", "target": "reloadtime", "value": 0.5 },
            {
              "op": "table_merge",
              "weapon_target": "arm_botrail",
              "target": "customparams",
              "value": {
                "stockpilelimit": 50,
                "spawns_name": "armham armjeth armpw armrock armwar armah armanac armmh armsh armart armfav armflash armjanus armpincer armsam armstump armzapper",
                "spawns_mode": "random"
              }
            }
          ]
        }
      ]
    },
    {
      "name": "Add Launchers to Cormandot4",
      "scope": "UnitDefsLoop",
      "conditions": [
        { "type": "nameMatch", "regex": "cormandot4" }
      ],
      "mutations": [
        { "op": "list_append", "target": "buildoptions", "value": "armmeatball" },
        { "op": "list_append", "target": "buildoptions", "value": "armassimilator" },
        { "op": "list_append", "target": "buildoptions", "value": "armpwt4" },
        { "op": "list_append", "target": "buildoptions", "value": "armt1" }
      ]
    }
  ]
}
